{
  "architecture_profile_ref": {
    "digest": "sha256:84e6b836e2cdb7a1fb8a35f822848242337ce24ac21ab256cb1a19560470bc0f",
    "id": "five-layer-baseline",
    "version": "1"
  },
  "capability_claims": {
    "evidence_refs": [
      "evidence.aws.baseline-capability-matrix"
    ],
    "extra_capability_ids": [],
    "missing_capability_ids": [],
    "provided_capability_ids": [
      "capability.archive-storage",
      "capability.cool-storage",
      "capability.hot-storage",
      "capability.ingestion",
      "capability.processing",
      "capability.twin-state",
      "capability.visualization"
    ],
    "required_capability_ids": [
      "capability.archive-storage",
      "capability.cool-storage",
      "capability.hot-storage",
      "capability.ingestion",
      "capability.processing",
      "capability.twin-state",
      "capability.visualization"
    ]
  },
  "compatibility": {
    "compatible_catalog_versions": [
      {
        "id": "baseline-component-catalog",
        "version": "1"
      }
    ],
    "compatible_deployment_specification_versions": [
      "resolved-deployment-specification.v1"
    ],
    "compatible_resolver_versions": [
      "1"
    ],
    "compatible_runtime_versions": [
      "1"
    ]
  },
  "component_mappings": [
    {
      "component_id": "component.archive-storage",
      "deployment_component_candidates": [
        "deployment.aws.archive-storage"
      ],
      "deployment_specification_component_ids": [
        "l3_archive.aws.s3"
      ],
      "deployment_specification_slot_ids": [
        "l3_archive_storage"
      ],
      "formula_refs": [
        "formula.archive-storage"
      ],
      "provided_capability_ids": [
        "capability.archive-storage"
      ],
      "required_capability_ids": [
        "capability.archive-storage"
      ],
      "service_model_refs": [
        "service-model.aws.archive-storage"
      ],
      "supported_region_ids": [
        "region.aws.eu-central-1"
      ]
    },
    {
      "component_id": "component.cool-storage",
      "deployment_component_candidates": [
        "deployment.aws.cool-storage"
      ],
      "deployment_specification_component_ids": [
        "l3_cool.aws.s3"
      ],
      "deployment_specification_slot_ids": [
        "l3_cool_storage"
      ],
      "formula_refs": [
        "formula.cool-storage"
      ],
      "provided_capability_ids": [
        "capability.cool-storage"
      ],
      "required_capability_ids": [
        "capability.cool-storage"
      ],
      "service_model_refs": [
        "service-model.aws.cool-storage"
      ],
      "supported_region_ids": [
        "region.aws.eu-central-1"
      ]
    },
    {
      "component_id": "component.hot-storage",
      "deployment_component_candidates": [
        "deployment.aws.hot-storage"
      ],
      "deployment_specification_component_ids": [
        "l3_hot.aws.dynamodb",
        "l3_hot.aws.reader_lambdas"
      ],
      "deployment_specification_slot_ids": [
        "l3_hot_storage"
      ],
      "formula_refs": [
        "formula.hot-storage"
      ],
      "provided_capability_ids": [
        "capability.hot-storage"
      ],
      "required_capability_ids": [
        "capability.hot-storage"
      ],
      "service_model_refs": [
        "service-model.aws.hot-storage"
      ],
      "supported_region_ids": [
        "region.aws.eu-central-1"
      ]
    },
    {
      "component_id": "component.ingestion",
      "deployment_component_candidates": [
        "deployment.aws.ingestion"
      ],
      "deployment_specification_component_ids": [
        "l1.aws.dispatcher_lambda",
        "l1.aws.iot_core"
      ],
      "deployment_specification_slot_ids": [
        "l1_ingestion"
      ],
      "formula_refs": [
        "formula.ingestion"
      ],
      "provided_capability_ids": [
        "capability.ingestion"
      ],
      "required_capability_ids": [
        "capability.ingestion"
      ],
      "service_model_refs": [
        "service-model.aws.ingestion"
      ],
      "supported_region_ids": [
        "region.aws.eu-central-1"
      ]
    },
    {
      "component_id": "component.processing",
      "deployment_component_candidates": [
        "deployment.aws.processing"
      ],
      "deployment_specification_component_ids": [
        "l2.aws.eventbridge",
        "l2.aws.processing_lambdas",
        "l2.aws.step_functions"
      ],
      "deployment_specification_slot_ids": [
        "l2_processing"
      ],
      "formula_refs": [
        "formula.processing"
      ],
      "provided_capability_ids": [
        "capability.processing"
      ],
      "required_capability_ids": [
        "capability.processing"
      ],
      "service_model_refs": [
        "service-model.aws.processing"
      ],
      "supported_region_ids": [
        "region.aws.eu-central-1"
      ]
    },
    {
      "component_id": "component.twin-state",
      "deployment_component_candidates": [
        "deployment.aws.twin-state"
      ],
      "deployment_specification_component_ids": [
        "l4.aws.connector_lambda",
        "l4.aws.twinmaker"
      ],
      "deployment_specification_slot_ids": [
        "l4_twin_state"
      ],
      "formula_refs": [
        "formula.twin-state"
      ],
      "provided_capability_ids": [
        "capability.twin-state"
      ],
      "required_capability_ids": [
        "capability.twin-state"
      ],
      "service_model_refs": [
        "service-model.aws.twin-state"
      ],
      "supported_region_ids": [
        "region.aws.eu-central-1"
      ]
    },
    {
      "component_id": "component.visualization",
      "deployment_component_candidates": [
        "deployment.aws.visualization"
      ],
      "deployment_specification_component_ids": [
        "l5.aws.managed_grafana"
      ],
      "deployment_specification_slot_ids": [
        "l5_visualization"
      ],
      "formula_refs": [
        "formula.visualization"
      ],
      "provided_capability_ids": [
        "capability.visualization"
      ],
      "required_capability_ids": [
        "capability.visualization"
      ],
      "service_model_refs": [
        "service-model.aws.visualization"
      ],
      "supported_region_ids": [
        "region.aws.eu-central-1"
      ]
    }
  ],
  "content_digest": "sha256:5cceae9f1d3bcbf6e243474bf5521413def677c7e80909237ea122b9f24f4065",
  "edge_mappings": [
    {
      "catalog_input_port_id": "catalog.aws.port.archive-storage.write-in",
      "catalog_output_port_id": "catalog.aws.port.cool-storage.transition-out",
      "cost_owner_ids": [
        "cost.cool-to-archive-storage"
      ],
      "destination_deployment_component_ids": [
        "deployment.aws.archive-storage"
      ],
      "edge_id": "edge.cool-to-archive-storage",
      "edge_implementation_id": "edge-implementation.aws.cool-to-archive-storage",
      "mechanism": "source_owned_transition_runtime",
      "source_deployment_component_ids": [
        "deployment.aws.cool-storage"
      ],
      "transfer_route_class": "same_provider_same_region"
    },
    {
      "catalog_input_port_id": "catalog.aws.port.twin-state.update-in",
      "catalog_output_port_id": "catalog.aws.port.hot-storage.twin-update-out",
      "cost_owner_ids": [
        "cost.hot-storage-to-twin-state"
      ],
      "destination_deployment_component_ids": [
        "deployment.aws.twin-state"
      ],
      "edge_id": "edge.hot-storage-to-twin-state",
      "edge_implementation_id": "edge-implementation.aws.hot-storage-to-twin-state",
      "mechanism": "provider_native_trigger",
      "source_deployment_component_ids": [
        "deployment.aws.hot-storage"
      ],
      "transfer_route_class": "same_provider_same_region"
    },
    {
      "catalog_input_port_id": "catalog.aws.port.cool-storage.write-in",
      "catalog_output_port_id": "catalog.aws.port.hot-storage.transition-out",
      "cost_owner_ids": [
        "cost.hot-to-cool-storage"
      ],
      "destination_deployment_component_ids": [
        "deployment.aws.cool-storage"
      ],
      "edge_id": "edge.hot-to-cool-storage",
      "edge_implementation_id": "edge-implementation.aws.hot-to-cool-storage",
      "mechanism": "source_owned_transition_runtime",
      "source_deployment_component_ids": [
        "deployment.aws.hot-storage"
      ],
      "transfer_route_class": "same_provider_same_region"
    },
    {
      "catalog_input_port_id": "catalog.aws.port.processing.telemetry-in",
      "catalog_output_port_id": "catalog.aws.port.ingestion.telemetry-out",
      "cost_owner_ids": [
        "cost.ingestion-to-processing"
      ],
      "destination_deployment_component_ids": [
        "deployment.aws.processing"
      ],
      "edge_id": "edge.ingestion-to-processing",
      "edge_implementation_id": "edge-implementation.aws.ingestion-to-processing",
      "mechanism": "provider_native_trigger",
      "source_deployment_component_ids": [
        "deployment.aws.ingestion"
      ],
      "transfer_route_class": "same_provider_same_region"
    },
    {
      "catalog_input_port_id": "catalog.aws.port.hot-storage.write-in",
      "catalog_output_port_id": "catalog.aws.port.processing.telemetry-out",
      "cost_owner_ids": [
        "cost.processing-to-hot-storage"
      ],
      "destination_deployment_component_ids": [
        "deployment.aws.hot-storage"
      ],
      "edge_id": "edge.processing-to-hot-storage",
      "edge_implementation_id": "edge-implementation.aws.processing-to-hot-storage",
      "mechanism": "provider_native_trigger",
      "source_deployment_component_ids": [
        "deployment.aws.processing"
      ],
      "transfer_route_class": "same_provider_same_region"
    },
    {
      "catalog_input_port_id": "catalog.aws.port.visualization.query-in",
      "catalog_output_port_id": "catalog.aws.port.twin-state.query-out",
      "cost_owner_ids": [
        "cost.twin-state-to-visualization"
      ],
      "destination_deployment_component_ids": [